,tweet
0,"Kota Bima (18/10), Kantor Imigrasi Bima mengikuti giat sosialisasi tata cara pengisian lembar kerja penilaian mandiri Sistem Pengendalian Intern Pemerintah (SPIP) di lingkungan Kantor Wilayah Kemenkumham NTB #KumhamNTBPastiJuare  #ImigrasiIndonesia  #RomiYudianto  https://t.co/O3RH76cgbt"
1,"5| G20 Indonesia terdiri dari sekitar 157 pertemuan yang akan digelar di beberapa tempat di Indonesia, seperti Bali, Jakarta, Jawa Barat, Jawa Tengah, Jawa Timur, Sumut, Yogyakarta, Papua Barat, NTB, NTT, Sulut, dan lainnya   #KemenkumhamSambutG20 Kemenkumham Sambut G20  https://t.co/WcvwbcA5ZM"
2,"@ARIFBIMANTB1 @ketekbuluwangi @CutSarina5 @adib_munjir Pantasan NTB kusus Bima itu gak maju2, kumuh dan SDM lemah"
3,"Wali Kota Bima H. Muhammad Lutfi, SE Silaturrahim dan Audiensi bersama Dewan Pengawas, Komisaris dan Direktur Bank NTB Syariah bertempat di Ruang Rapat Wali Kota pada Senin, 17 Oktober 2022.   https://t.co/y8f5h2aYXG  https://t.co/Cd4xNNweGy"
4,Fasilitasi APBDesa perubahan Padolo lanjut Kantor Camat Evaluasi APBDesa Perubahan Teke Palibelo Bima NTB.17102022 @jokowi @halimiskandarnu  @tppkemendes  @kamildesa1  @Brigade01Arwan1  @Tauhid168999  @Rosmiat39197369  @SusantoSaputro1  https://t.co/yOwMpGN0iK
5,@_syfp @skeletonkingg_ Bima NTB ya?
6,@ListyoSigitP Saya Tantang Tes urin terbuka anggotanya pak Kapolri dibagian Satnarkoba polres kota Bima. Tes urin terbuka di Polda NTB panggil semua Media TV dan online. Biar masyarakat Indonesia tau ..  https://t.co/0alLhvXhN3
7,Upaya Membangun Kemandirian Desa Dengan Melakukan Fasilitasi &amp; Pendampingan. @jokowi  @halimiskandarnu  @kemendespdtt  @ditjenpdp  @P3MD_NTB  @BimaP3md  @P3md_Kab_Bima  https://t.co/wLYTsgtQ5e
8,"Kasus gigitan anjing yang diduga terinfeksi virus rabies di Kabupaten Bima, Nusa Tenggara Barat (NTB) terus meningkat. Hingga kini sudah menembus 205 kasus.  Via: detikBali   https://t.co/Idz3ElSQb5"
9,"@propampolri Mohon turunkan anggota paminal untuk melakukan bersih-bersih polri di Polres Bima kota NTB. Satnarkoba polres kota Bima telah membebaskan para terduga bandar narkoba,  https://t.co/X2Bw5fHznj"
10,"BGP NTB menyelenggarakan Lokakarya 7 Angkatan 4 Program PGP dengan tema Festival Panen Hasil Belajar. Lokakarya ini dilakukan serentak pada tanggal 15-16 Oktober 2022 di 3 kabupaten wilayah kerja NTB yakni Lombok Utara, Lombok Timur dan Bima.  https://t.co/44UxL8pja5"
11,@hariyantorina2 Ini mah banjir di bima NTB min🤢 video lama
12,17/10/2022 #OneHealthKIPM  Kegiatan pengawasan lalulintas perikanan dari pelabuhan sape - NTB tujuan pelabuhan labuan bajo -NTT #KKPAccelerate  @JonisonRaban @bkipm_kkp @WilkerPel_Bima @fqia_labuanbajo  @wilkersapebima  https://t.co/Wf0y4CNijQ
13,@BaturVolcano Salam juga dari Lambu Bima NTB....mg hasil melimpah dan berkah bli
14,Survei Lokasi Keluarga Sdr. Syaukin dari Bima NTB | Akhtara Residence | 082245327354  https://t.co/wShEIVfQNa
15,"Didominasi Pelajar dan Mahasiswa, 592 Orang Ditilang Selama Operasi Zebra Rinjani di Kota Bima  https://t.co/zqIcTTW4D0"
16,@ListyoSigitP Mohon pak Kapolri Jenderal polisi @ListyoSigitP @polda_ntb1 @propampolri @DivHumas_Polri . Mohon atensi wilayah Hukum Polda NTB khususnya Polres Bima kota. Agar melakukan Penyelidikan serta investigasi terkait bebasnya para terduga bandar narkoba yg mereka tangkap  https://t.co/gg8DeiryTB
17,Kabupaten Bima Wakili NTB di Festival Qasidah Nasional di Jawa Barat  https://t.co/YdkejJ5sTT
18,"Gempa Hari Ini Minggu 16 Oktober 2022 Getarkan Maluku, Lombok Timur, dan Bima NTB  https://t.co/AydFMbCNBb"
19,"Gempa Hari Ini Minggu 16 Oktober 2022 Getarkan Maluku, Lombok Timur, dan Bima NTB  https://t.co/Yf2VAcAIcM"
20,"Gempa, Minggu 16 Oktober 2022, Guncang Bima NTB dengan Magnitudo 5,3 dan Maluku Barat Daya #earthquake #gempabumi #ntb  https://t.co/k4wCg0noCZ"
21,"@ListyoSigitP Kami mohon pada bapak Kapolri perintahkan Kapolda NTB agar memproses oknum oknum yg membebaskan para terduga bandar narkoba yg ada di polres kota Bima, saya pertanyakan terkait bebasnya malah akun Facebook Polres Bima kota memblokir Facebook saya, tindak tegas anak buahnya pak  https://t.co/jV6aY3T6CM"
22,Lagi nonton video BIMA NTB - Jakarta. Tebak berapa hari? Yak benar 3 hari 2 malam seharga 985k. Anjay. Naik bus.
23,"Tari Lenggo (Bima), merupakan tarian Kerajaan Bima yg prnh berkuasa di NTB. Biasa dipentaskan utk menjamu tamu resmi @lelakon_negeri  @sekatabi_jp  @NayYanick  @smasatup  @LekMarteg  @Anpras7 @lelahku  @B3r_vitamin  @NgkongRoses  @EbinTommy  @Jayen80837002  @OmBregas1   🙏💙⚘  https://t.co/0MFK0s7LeZ"
24,"Bima NTB Diguncang Gempa M 5,3  https://t.co/2c7eRCTAdL #BimaNtb #Gempa #Bmkg #Wahananewsco"
25,Baru saja mengirim foto @ Pantai Matiti Dompu Ntb  https://t.co/E1VdKHYsmE
26,"Gempa M 5,3 Guncang Bima, NTB.  https://t.co/xeZkuHc5Dw Via: CNN  https://t.co/03gGR4hS1b #TopReport #Nasional #BESTARI"
27,"Gempa, Minggu 16 Oktober 2022, Guncang Bima NTB dengan Magnitudo 5,3 dan Maluku Barat Daya -  https://t.co/Sj2guhghSK"
28,"BMKG meminta masyarakat tetap tenang karena gempa bumi M 5,3 di Bima, NTB, tidak berpotensi tsunami. #gempa  https://t.co/E4VDTMf2So"
29,"BMKG : Gempa bumi magnitudo 5,3 di wilayah Bima NTB tidak berpotensi tsunami  https://t.co/vihT5IULDy"
30,"BMKG melaporkan terjadi gempa bumi di Kabupaten Lombok timur, dan Bima, Sumbawa, Nusa Tenggara Barat (NTB), pada hari ini, Minggu 16 Oktober 2022.  https://t.co/dkv8FpDBOK"
31,"Festival LASQI NTB, Kontingen Kabupaten Bima Raih Juara Umum - .  https://t.co/7MEWoG56dD"
32,"@ListyoSigitP Banyak masyarakat provinsi NTB. Yg sangat kecewa, pada kinerja kepolisian Polres Bima kota. Karna Satnarkoba polres kota Bima. Telah membebaskan para bandar narkoba.  https://t.co/aNxNyP9JbH"
33,@ListyoSigitP Mohon di tanggapi atas kekecewaan masyarakat di Bima dan Dompu NTB pak kapolri @ListyoSigitP  atas gagalnya Anggota nya di polres Bima kota ..  https://t.co/YkdHCNEk4Y
34,"BMKG menyatakan gempa bumi magnitudo 5,3 yang terjadi di wilayah Bima, Nusa Tenggara Barat (NTB), tidak berpotensi tsunami.  https://t.co/6MNTN3fSac  https://t.co/bnLMJND7ko"
35,"@ListyoSigitP Banyak masyarakat yg kecewa kepada bapak Kapolri dan Polres kota Bima , provinsi NTB .. atas kinerja nya yg kurang bagus, Satnarkoba polres kota Bima telah membebaskan para bandar narkoba.. mohon di tindak lanjuti pak semakin mnrn kepercayaan masyarakat terhadap Kepolisian  https://t.co/Fb6wABLdwH"
36,Kota Bima NTB Dilanda Gempa Bumi  https://t.co/bwqkDEEtIr
37,"Setelah Bima, Gempa Bumi Kembali Guncang Lombok NTB  https://t.co/Fue2QvHIcz  https://t.co/1dYsh1zXXe"
38,"Minggu Pagi, Gempa M5,3 Guncang Bima NTB  https://t.co/qrpwqicuLd"
39,"2 Gempa Dalam dengan magnitudo 5 terjadi di wilayah Timur Indonesia Minggu 16 Oktober 2022 - M 5,1 ( 01:31 WIB) kedalaman 160 km, TIMOR LESTE, LAUT BANDA - M 5,3 ( 04:22 WIB) kedalaman 123 km,NTB, BIMA  https://t.co/pKPklrBiK8"
40,"Gempa Magnitudo 5,3 Getarkan Bima NTB  https://t.co/JwUAEjCEG8"
41,"Minggu Pagi, Gempa M5,3 Guncang Bima NTB  https://t.co/3WAGXLHOuC"
42,"Minggu Pagi, Gempa M5,3 Guncang Bima NTB  https://t.co/nPX74OH7kN"
43,"Kota Bima, NTB Diguncang Gempa 5,3 SR  https://t.co/oHexALM9H8"
44,"Bima NTB Diguncang Gempa Bumi Magnitudo 5,3, Ada Potensi Tsunami?  https://t.co/X9fqq29ZSz"
45,Published on YouTube: 🔴 BIMA NTB MEMANAS❗ANCAMAN❗PERSEKUSI ❗HIJRAH DARI SEKTE ISLAM JAMAAH  https://t.co/LxE1QNzKHB  #LDII 354 #JOKAM #IslamJamaah #HIJRAH #MengawalParadigmaBaru #MubalighHijrah
46,"@ListyoSigitP Kami ingin Dari satnarkoba polres kota Bima NTB . Di rombak semua pak, karna mereka setiap x penangkapan tidak pernah lakukan pengembangan serta penyelidikan jika mereka melakukan pasti bandar besar narkoba akan di tangkap tapi mereka tidak melakukan pengembangan serta penyelidik  https://t.co/xzybLUf74H"
47,"Gempa di Bima NTB dengan Magnitudo 5,2 Tidak Berpotensi Tsunami #Gempa  #NTB #BMKG  https://t.co/FsZRZyvz9Z"
48,"Gempa bumi magnitudo 5,3 guncang Bima NTB  https://t.co/ZMtIUO0uu3"
49,"Info Gempa Mag:5.3, 16-Okt-22 04:22:49 WIB, Lok:8.65 LS, 118.92 BT (28 km Tenggara KOTA-BIMA-NTB), Kedlmn:123 Km, dirasakan di Bima dan Dompu III MMI ::BMKG  https://t.co/mjlIncm5kA"
50,"@ListyoSigitP Kita lapor ke Polda tidak pernah di tanggapi dengan serius, Saya pastikan pak  kepercayaan masyarakat terhadap Kepolisian semakin menurun karna terkait anak buah bapak yg ada di Bima NTB khususnya Polres Bima kota nakal dengan para bandar besar narkoba sehingga ada yg dibebaskan"
51,@ListyoSigitP Pak Kapolri mana janji anda pak. Anda bilang jika anggota melakukan pelanggaran maka masyarakat wajib lapor ke saya . Agar tindak lanjut.. mana janji anda Itu di Bima NTB narkoba semakin merajalela karna ada banyak oknum polisi yg membek-up para bandar besar narkoba#Polreskotabim
52,"Gempa M 5,3 Guncang Bima, NTB  https://t.co/DAvxqIgmFU"
53,"Gempa M 5,3 Guncang Bima, NTB  https://t.co/hCdKQspSFy"
54,"Gempa bumi berkekuatan 5,3 magnitudo mengguncang Kota Bima, NTB. Gempa terjadi pada Minggu (16/10) pukul 04.22 WIB. #kumparanNEWS  https://t.co/LQ3CvaEXWS"
55,"Gempa Magnitudo 5,3 Guncang Bima NTB #LengkapCepatBeritanya #BeritaTerkini #BeritaDaerah .  https://t.co/7MLPXZXlB5"
56,"Gempa Bumi Minggu 16 Oktober 2022 04:22 WIB Tidak berpontensi tsunami 28 km Tenggara KOTA-BIMA-NTB Jarak dari Semarang: 954 km Koordinat: -8.65,118.92 Magnitude: 5.3 Kedalaman: 123 km  #sipantau Sumber : BMKG"
57,"Ada #Gempa 28 km Tenggara KOTA-BIMA-NTB yang berkekuatan 5.3 SR dengan kedalaman 123 km pada koordinat: -8.65 dan 118.92, tanggal 16 Oct 2022 04:10 WIB  https://t.co/RXxuHeBwJO"
58,"[BMKG] M5.3 Oct-15 21:30:03 UTC, 28 km Tenggara KOTA-BIMA-NTB, Depth:123.0km,  #quake  https://t.co/9RN3KsaymS"
59,"Terjadi Gempa, 28 km Tenggara KOTA-BIMA-NTB, 16 Okt 2022, 04:22:49 WIB | Koordinat 8.65 LS, 118.92 BT | Magnitudo 5.3, Kedalaman 123 km | Tidak berpotensi tsunami |  https://t.co/SeRojt5l26"
60,"#Gempa Mag:5.3, 16-Okt-22 04:22:49 WIB, Lok:8.65 LS,118.92 BT (28 km Tenggara KOTA-BIMA-NTB), Kedlmn:123 Km, tdk berpotensi tsunami. @infoBMKG  https://t.co/TXpgm6NQem"
61,"16-10-22 04:22:49 WIB, #GEMPA, Daya: SEDANG, Magnitude: 5.3, Kedalaman: 123 Km, Pusat: 28 km Tenggara KOTA-BIMA-NTB, Map:  https://t.co/SfZPZ7ICua  #InfoGempa #EarthQuakeIndonesia"
62,"#Gempa Magnitudo: 5.3, Kedalaman: 123 km, 16 Okt 2022 04:22:49 WIB, Koordinat: 8.65 LS-118.92 BT (28 km Tenggara KOTA-BIMA-NTB), Tidak berpotensi tsunami #BMKG  https://t.co/OiHiTwvX8x"
63,"#Gempa Mag:5.3, 16-Okt-22 04:22:49 WIB, Lok:8.65 LS,118.92 BT (28 km Tenggara KOTA-BIMA-NTB), Kedlmn:123 Km, tdk berpotensi tsunami #BMKG  https://t.co/LOlVzL8iw5"
64,"Boyong Trophy Festival LASQI, Kontingen Kabupaten Bima jadi Duta NTB  https://t.co/52N5htpzk6"
65,Paguyuban Pasundan Bima Gelar Maulid Nabi Muhammad SAW  https://t.co/KNM137DWWX
